{
  "$schema": "http://json-schema.org/draft-07/schema#",
  "type": "object",
  "properties": {
    "_data": {
      "type": "object"
    },
    "s-code": {
      "type": "string"
    },
    "candidate-id": {
      "type": "string"
    },
    "client-user-id": {
      "type": "string"
    },
    "_func": {
      "type": "string"
    },
    "candidate-name": {
      "type": "string"
    }
  },
  "required": [
    "_data",
    "s-code",
    "candidate-id",
    "client-user-id",
    "_func",
    "candidate-name"
  ]
}